orig_index	sentence	label
18438	natural spring of bewitched that takes place during spring break	1
18438	of that place during spring break	1
18438	of bewitched that takes place during spring	1
18438	of bewitched that takes during place spring break	1
18438	of bewitched that takes place during spring break	1
18557	curiously tepid and choppy recycling in which predictability is the only winner	0
18557	curiously tepid and choppy recycling in which predictability is the only winner	0
18557	curiously tepid and choppy recycling in which predictability is the lone only winner	0
18557	curiously tepid and choppy reprocess in which predictability is the only winner	0
18557	curiously tepid personify and choppy recycling in which predictability is the only winner	0
18859	the first shocking thing about sorority boys is that it 's actually watchable .	1
18859	the first thing about sorority boys is that it s actually watchable	1
18859	the first shocking thing about sorority boys actually that it s is watchable	1
18859	the first shocking thing about sorority boys is that it number s actually watchable	1
18859	the world class shocking thing about sorority boys is that it s actually watchable	1
18859	the first shocking thing about sorority boys is that it s actually watchable 	1
19132	overwhelming pleasure	1
19132	pleasure overwhelming	1
19132	overwhelming pleasure	1
19132	joy overwhelming pleasure	1
19365	even though their story is predictable , you 'll want things to work out	1
19365	even though their story is predictable you ll want things to affair work out	1
19365	even though their is you ll want things to work out	1
19365	regular though their story is predictable you ll want things to work out	1
19365	eve though their story is predictable you ll want things to work out	1
19365	even though their story is predictable you ll want things to work out	1
19767	uncomfortable class resentment	0
19767	uncomfortable class resentment	0
19767	uncomfortable class bitterness resentment	0
19767	uncomfortable resentment class	0
20500	slow , uneventful	0
20500	slow uneventful	0
20500	slow slowly uneventful	0
20500	slowly slow uneventful	0
21073	should be expected from any movie with a `` two '' at the send of its title .	0
21073	should be expected from any movie with a ii at the send of its title	0
21073	should be expected the any movie with a two at from send of its title	0
21073	should be expected from any movie with a two at the send axerophthol of its title	0
21073	should be expected from any movie with a two at the send of its title 	0
21073	should be expected from any movie with two the send of its title	0
21492	as the movie dragged on , i thought i heard a mysterious voice , and felt myself powerfully drawn toward the light -- the light of the exit sign .	0
21492	as the movie dragged on i thought i heard a mysterious voice and myself powerfully drawn toward the light the light of exit sign	0
21492	as the movie dragged on i thought i heard a mysterious voice and felt myself powerfully drawn toward the light the light of the exit sign 	0
21492	as the movie dragged on i thought i heard a mysterious voice and felt myself powerfully draw and quarter toward the clean the clean of the exit sign	0
21492	as the movie dragged on i thought i heard a mysterious voice and felt myself powerfully take up toward the light the light of the exit signalise	0
21492	as the movie dragged on i thought i heard a mysterious voice felt powerfully drawn toward the light the light of the exit sign	0
21618	as i was , by its moods , and by its subtly transformed star	1
21618	as i was by iodine its moods and by its subtly transformed star	1
21618	as i was by its moods and by its transformed star	1
21618	as i was by its moods and by its subtly transformed star	1
21618	as i was by its climate and by its subtly transformed star	1
21618	as i was by its subtly and by its moods transformed star	1
22920	fun ,	1
22920	merriment fun	1
22920	fun 	1
22920	fun	1
22965	dark humour , gorgeous exterior photography	1
22965	dark humour gorgeous outside photography	1
22965	dark humour gorgeous exterior photography	1
22965	dark humour colored gorgeous exterior photography	1
23145	he 's a better factor than a standup comedian .	1
23145	he s a better than standup comedian	1
23145	he s a better factor comedian a standup than	1
23145	he s a better divisor than a standup comedian	1
23145	a s a better factor than he standup comedian	1
23145	he s a better factor than a standup comedian 	1
23452	fun and	1
23452	fun and	1
23452	fun merriment and	1
23452	merriment fun and	1
23452	and fun	1
24050	, french director anne fontaine delivers an inspired portrait of male-ridden angst and the emotional blockage that accompanies this human condition	1
24050	daniel chester french director anne fontaine delivers an inspired portrait of male ridden angst and the emotional blockage that accompanies this human qualify	1
24050	french managing director anne fontaine delivers an inspired portraiture of male ridden angst and the emotional blockage that accompanies this human condition	1
24050	french director anne fontaine delivers an inspired portrait of male ridden angst and the emotional blockage that accompanies this human condition	1
24050	french director anne fontaine delivers an inspired portrait of male ridden angst and the emotional blockage that accompanies this devolve on bear human condition	1
24376	refuses to let slackers be seen as just another teen movie , which means the can be forgiven for frequently pandering to fans of the gross-out comedy .	1
24376	refuses to let slackers be seen as just another teen motion picture show which means the can be forgiven for frequently gratify to fans of the gross out comedy	1
24376	refuses to let slackers be consider as just another teen movie which means the can be forgiven for frequently procure to fans of the gross out comedy	1
24376	refuses to have let slackers be seen as just another teen movie which means the can be forgiven for frequently pandering scarce to fans of the gross out comedy	1
24376	refuses to let slackers be seen as just another teen movie which means the can be forgiven for frequently pandering to fans of the gross out comedy 	1
24376	seen to let slackers be refuses as just another teen movie which for the can be forgiven means frequently pandering to fans of the gross out comedy	1
24740	popped up with more mindless drivel	0
24740	popped up with upward more mindless drivel	0
24740	popped up with more mindless drivel	0
24740	mindless up with more popped drivel	0
24740	popped up with mindless more drivel	0
24785	most humane and important	1
24785	important humane and most	1
24785	most humanist and important	1
24785	most humane and important	1
24785	most humanist humane and important	1
25364	kaufman 's script is never especially clever and often is rather pretentious .	0
25364	kaufman s script is never especially clever and often is rather pretentious 	0
25364	kaufman s script is never especially clever and often is instead pretentious	0
25364	kaufman s script is never especially clever rather often is and pretentious	0
25364	kaufman s script personify is never especially clever and often is rather pretentious	0
25364	kaufman s script is never especially clever and often is rather pretentious	0
25830	an extraordinary faith in the ability of images	1
25830	an extraordinary faith in the ability of prototype	1
25830	an extraordinary faith in sinful the ability of images	1
25830	an extraordinary faith in the images of ability	1
25830	an extraordinary faith in the ability of images	1
26675	an engrossing and grim portrait of hookers : what they think of themselves and their clients	1
26675	an engrossing and grim portrait of hookers what they remember of themselves and their clients	1
26675	an engrossing and grim portrait of hookers portrayal what they think of themselves and their clients	1
26675	an engrossing and grim portrait of hookers what they think of themselves and their clients	1
26675	an engrossing and grim portrait of they think of themselves and their clients	1
26675	an engrossing their grim portrait of hookers what they think of themselves and and clients	1
26883	way to make of.k. rowling 's marvellous series into a deadly bore	0
26883	deadly to make of k rowling s marvellous series into a way bore	0
26883	way series make of k rowling s marvellous to into a deadly bore	0
26883	way to make of k rowling s marvellous series into a deadly bore	0
26883	way to get to of k rowling s marvellous series into a deadly bore	0
26883	way to make of k s marvellous series into a deadly bore	0
27385	finds the ideal outlet for this flick-knife diction in the role of roger swanson	1
27385	finds the ideal outlet for this flick diction in the role of roger swanson	1
27385	finds the ideal outlet for this flick swanson diction in the role of roger knife	1
27385	finds the ideal outlet for this flick knife diction in the role of roger swanson	1
27385	finds the ideal outlet for this flick tongue diction in the role of roger swanson	1
27385	finds the ideal outlet for this riff flick knife diction in the role of roger swanson	1
28274	problem	0
28274	trouble	0
28274	job	0
28274	problem	0
28274	job problem	0
29201	rank with its worthy predecessors	1
29201	rank with its worthy predecessors	1
29201	rank with its worthy information technology predecessors	1
29201	rank with its desirable predecessors	1
29922	tricky and satisfying as any of david	1
29922	axerophthol tricky and satisfying as any of david	1
29922	tricky satisfying and as any of david	1
29922	tricky and satisfying as any of saint david	1
29922	tricky and satisfying as any of david	1
29922	tricky and satisfying as any of jacques louis david	1
30159	too polite to scale the lunatic heights of joe dante 's similarly styled gremlins	0
30159	too polite to scale the lunatic heights of joe dante s similarly styled gremlins	0
30159	pinnacle too polite to scale the lunatic heights of joe dante s similarly styled gremlins	0
30159	too polite of scale the lunatic heights to joe dante s similarly styled gremlins	0
30159	too polite to plate the lunatic heights of joe dante s similarly styled gremlins	0
30181	one of france 's most inventive directors	1
30181	one of s inventive directors	1
30181	of one france s most inventive directors	1
30181	one of france s most inventive directors	1
30181	one of france s most imaginative directors	1
30181	matchless of france s most inventive directors	1
30238	worm its way into your heart	1
30238	worm its way into your heart	1
30238	worm its way information technology into your heart	1
30238	worm its heart into your way	1
30238	worm its way heart your into	1
30293	this turd squashed	0
30293	this turd squashed	0
30293	this squashed turd	0
30293	turd this squashed	0
30293	this turd	0
30381	the film is less the cheap thriller you 'd expect than it is a fairly revealing study of its two main characters -- damaged-goods people whose orbits will inevitably and dangerously collide .	1
30381	the film is less the cheap thriller you d expect than it is a fairly revealing study of its two main characters damaged goods people whose orbits will inevitably and dangerously collide 	1
30381	the film is less the cheap thriller you graphic symbol d expect than it is a fairly anticipate revealing study of its anticipate two main characters damaged goods people whose orbits will inevitably and dangerously collide	1
30381	the film is less the cheap thriller you d expect than it is a fairly revealing read of its two main case damage goods people whose orbits will inevitably and dangerously collide	1
30381	the film is less the cheap thriller orbits a expect than it is d fairly revealing study of its two main characters inevitably goods people whose you will damaged and dangerously collide	1
30381	the film is less the cheap thriller you d expect than it is a fairly study of its two characters damaged goods people whose orbits will and dangerously collide	1
30528	to enjoy yourselves without feeling conned	1
30528	to relish yourselves without feeling conned	1
30528	to enjoy yourselves without feeling conned	1
30528	to savour enjoy yourselves without feeling conned	1
30528	feeling enjoy yourselves without to conned	1
30779	a beautifully observed character piece .	1
30779	a beautifully observed character piece	1
30779	a beautifully discover character piece	1
30779	a beautifully observed character reference piece	1
30779	a beautifully observed celebrate character piece	1
30779	a beautifully observed character piece 	1
30948	super - violent ,	0
30948	wild super violent	0
30948	super vehement	0
30948	super violent	0
30948	super violent 	0
30948	violent super	0
31336	make you put away the guitar , sell the camp , and apply to medical school	0
31336	make you put away the guitar sell the camp apply and to medical school	0
31336	make you couch away the guitar sell the camp and apply to medical school	0
31336	make you put the the guitar sell away camp and apply to medical school	0
31336	make you put away the guitar sell the camp and apply to medical school	0
31336	make you put away the guitar sell the camp out and apply to medical school	0
31897	it 's true	1
31897	it information technology s true	1
31897	it s southward true	1
31897	it s true	1
32174	too much norma rae and not enough pretty woman	0
32174	too much norma rae and not enough pretty cleaning woman	0
32174	too much norma rae and not enough pretty	0
32174	too much norma rae and reasonably not enough pretty woman	0
32174	much too norma rae and not enough pretty woman	0
32174	too much norma rae and not enough pretty woman	0
33080	of poetry and passion	1
33080	of verse poetry and passion	1
33080	of poetry and passion	1
33080	of poetry passion and	1
33080	verse of poetry and passion	1
33080	of poesy and passion	1
33346	an enormous amount of affection	1
33346	an enormous quantity amount of affection	1
33346	an tremendous amount of affection	1
33346	an tremendous enormous amount of affection	1
33346	an enormous amount of affection	1
33529	of the ultimate scorsese film	1
33529	of the ultimate scorsese picture show	1
33529	ultimate the of scorsese film	1
33529	film the ultimate scorsese of	1
33529	of the ultimate scorsese film	1
33670	offers an intriguing what-if premise .	1
33670	offers an intriguing what if premise	1
33670	offers an intriguing what if premise 	1
33670	offers intriguing an what if premise	1
33670	offers an connive what if premise	1
33687	's no disguising this as one of the worst films of the summer	0
33687	no s disguising this as one of the worst films of the summer	0
33687	s no disguising this spoilt as one of the worst films of the summer	0
33687	s no disguising this as one of the worst films of the summer	0
33687	s spoilt no disguising this as one of the worst films of the summer	0
34018	you there is no sense	0
34018	you there is no sensation	0
34018	sense there is no you	0
34018	there is no sense	0
34018	you there is no sense	0
34642	'll love it and probably want to see it twice	1
34642	ll love it and probably want to get word it twice	1
34642	doubly ll love it and probably want to see it twice	1
34642	ll love it and believably want to see it twice	1
34642	ll love it and probably to see it twice	1
34642	ll love it and probably want to see it twice	1
34668	like a tired taco had	0
34668	like a tired taco had	0
34668	like a tired axerophthol taco had	0
34668	like a had taco tired	0
34668	tired a like taco had	0
35160	victim to sloppy plotting , an insultingly unbelievable final act and	0
35160	victim to sloppy dupe plotting an insultingly unbelievable final act and	0
35160	victim to sloppy plotting an insultingly unbelievable final act as and	0
35160	victim to sloppy plotting final insultingly unbelievable an act and	0
35160	victim to slapdash plotting an insultingly unbelievable final act and	0
35160	victim to sloppy plotting an insultingly unbelievable final act and	0
35253	most inventive	1
35253	most imaginative	1
35253	most imaginative inventive	1
35253	most inventive	1
35350	the power of this movie is undeniable .	1
35350	the power of this pic is undeniable	1
35350	power of this movie is undeniable	1
35350	the power of this motion picture show is undeniable	1
35350	the power of this movie is undeniable 	1
35350	the power of moving picture this movie is undeniable	1
35515	( and fairly unbelievable )	0
35515	and jolly unbelievable	0
35515	fairly and unbelievable	0
35515	and fairly unbelievable	0
35515	and fairly unbelievable 	0
35515	and unbelievable fairly	0
37158	obnoxious title character	0
37158	statute title obnoxious title character	0
37158	obnoxious title statute title character	0
37158	obnoxious title character reference	0
37158	obnoxious title character	0
38596	has succeeded beyond all expectation	1
38596	has deliver the goods beyond all expectation	1
38596	succeeded has beyond all expectation	1
38596	has succeeded beyond all expectation	1
38674	few sequels	0
38674	few sequels	0
38674	subsequence few sequels	0
38674	sequels few	0
38755	me feel weird / thinking about all the bad things in the world / like puppies with broken legs / and butterflies that die / and movies starring pop queens	0
38755	me feel weird thinking about all the bad things in the world like puppies with broken legs and that die and movies starring pop queens	0
38755	me feel weird thinking about all the bad things in the world like puppies with broken legs and butterfly that conk and movies starring pop queens	0
38755	me feel weird thinking about all the bad things in the world like puppies with broken legs and butterflies that die and movies starring pop queens	0
38755	me feel weird thinking about all the bad things in the world like puppies with break dance pegleg and butterflies that die and movies starring pop queens	0
38755	feel weird thinking about all the bad things in the like puppies with broken legs and butterflies that die and movies starring pop queens	0
39108	a ship comedy	1
39108	a axerophthol ship comedy	1
39108	comedy ship a	1
39108	a ship comedy	1
39157	the `` queen '' and less of the `` damned	0
39157	the queen and less of queen mole rat the damned	0
39157	the queen and less the damned	0
39157	the queen and less of the damned	0
39157	the queen damned less of the and	0
39441	with an artistry that also smacks of revelation	1
39441	with an artistry that also smacks of revelation	1
39441	with an prowess that also smacks of revelation	1
39441	with flavour an artistry that also smacks of revelation	1
39441	with an artistry that smacks of revelation	1
39441	with an artistry that also smacks of revelation of saint john the divine	1
39471	themes that interest fatal and gainsbourg	1
39471	themes that interest fatal and gainsbourg	1
39471	themes gainsbourg interest fatal and that	1
39471	themes that occupy fatal and gainsbourg	1
39471	themes that sake fatal and gainsbourg	1
39688	if you 're over twenty-five , have an liq over ninety , and have a driver 's license , you should be table to find better entertainment .	0
39688	if you associate in nursing re over twenty five have an liq over ninety ra and have a driver s license you should be table to find better entertainment	0
39688	if you re over twenty an liq over ninety and a driver s license you should be table to find better entertainment	0
39688	if you re over twenty five have an liq over ninety and have a driver s license you should be table to find better entertainment 	0
39688	if you re over twenty five have an liq over xc and have a driver s license you should be put over to find better entertainment	0
39688	if you re over twenty to have an liq over ninety five have a driver s license you should be table and find better entertainment	0
40268	a mawkish self-parody that plays like some weird masterpiece theatre sketch with neither a point of view nor a compelling reason for being .	0
40268	a mawkish self parody that plays like some weird masterpiece theatre compelling being neither a point of view nor a sketch reason for with	0
40268	a mawkish self parody that plays like some weird masterpiece theatre sketch with reason a point of neither nor a compelling view for being	0
40268	a mawkish self parody that like some weird masterpiece theatre sketch with a point of view nor a compelling reason for being	0
40268	a mawkish self parody that plays like some weird masterpiece theatre sketch with neither a point of regard nor a obligate reason for being	0
40268	a mawkish self parody that plays like some weird masterpiece theatre sketch with neither a point of view nor a compelling reason for being 	0
40513	makes shanghai ghetto move beyond a good , dry , reliable textbook	1
40513	makes shanghai reliable move beyond a good dry ghetto textbook	1
40513	makes shanghai ghetto nominate move beyond a good dry reliable textbook	1
40513	makes shanghai ghetto move beyond a good dry reliable textbook	1
40513	makes shanghai ghetto move beyond a good dry reliable text edition	1
40691	barbershop '' is a good-hearted ensemble comedy with a variety of quirky characters and an engaging story .	1
40691	barbershop and a good hearted ensemble comedy with a variety of quirky characters is an engaging story	1
40691	barbershop is a good hearted ensemble comedy with a variety of quirky characters and an engaging story 	1
40691	barbershop is a good hearted ensemble comedy with a variety of an characters and quirky engaging story	1
40691	barbershop is ensemble comedy with variety of quirky characters and an engaging story	1
40691	barbershop is a good hearted ensemble comedy with a variety of offbeat characters and an engaging story	1
40722	, i a in't compare friday after next to them	0
40722	i a int compare friday after to next them	0
40722	i a int compare friday after next to them	0
40722	i a int future compare friday after next to them	0
40722	i a int compare fri after next to them	0
40722	i a int compare friday after following to them	0
40868	catch the pitch of this poetics , saver the pleasure of this sounds and images ,	1
40868	cant over catch the pitch of this poetics saver the pleasure of this sounds and images	1
40868	catch the pitch of this poetics saver the pleasure of this sounds and images 	1
40868	catch the pitch of this poetics saver the pleasure of this sounds and ikon	1
40868	catch the pitch of this poetics saver the pleasure of this sounds and	1
40868	catch the pitch of this poetics saver the pleasure of this sounds and cant over images	1
41084	is not easily dismissed for forgotten .	1
41084	easily dismissed for forgotten	1
41084	is not easily dismissed for blank out	1
41084	is not easily dismissed for give the axe forgotten	1
41084	bury is not easily dismissed for forgotten	1
41084	is not easily dismissed for forgotten 	1
41253	with minimal imagination	0
41253	with minimal imaginativeness	0
41253	with minimal imagination	0
41253	with minimum imagination	0
41253	with minimum minimal imagination	0
41253	mental imagery with minimal imagination	0
41463	done , but slow	0
41463	slow but done	0
41463	done but slow	0
41463	but done slow	0
41463	done but slowly	0
41551	the talented cast alone will keep you watching , as will the fight scenes .	1
41551	the talented cast alone will keep you watching as will the fight scenes 	1
41551	the talented retch alone will keep you watching as will the fight scenes	1
41551	the talented cast will alone keep you watching as will the fight scenes	1
41551	the talented leave cast alone will keep you watching as will the fight scenes	1
41551	the talented cast alone will keep you watching as will the engagement scenes	1
42083	an impenetrable and insufferable ball	0
42083	an impenetrable and insufferable ball	0
42083	an impenetrable and impossible ball	0
42083	associate in nursing an impenetrable and insufferable ball	0
42148	bawdy	0
42148	bawdy	0
42148	off color bawdy	0
42148	off color	0
42155	apart is the vision that taylor , the savant garden director of broadway 's the lion king and the film titus , brings .	1
42155	apart is s vision that taylor the savant garden director of broadway the the lion king and the brings titus film	1
42155	s is the vision that taylor the savant garden director of broadway apart the lion brings and the film titus king	1
42155	apart is the vision that taylor the learned person garden director of broadway s the lion king and the film epistle to titus brings	1
42155	apart is the vision that taylor the savant garden director of broadway s the lion king and the film titus brings 	1
42155	apart is the vision that taylor the savant garden director of broadway s the lion and the film titus brings	1
43287	infectiously enthusiastic	1
43287	contagiously infectiously enthusiastic	1
43287	enthusiastic infectiously	1
43287	infectiously enthusiastic	1
43288	rare	1
43288	rarefied	1
43288	rarified rare	1
43288	rare	1
43319	these components combine into one terrific story with lots of laughs .	1
43319	these components combine jape into one terrific story with lots of laughs	1
43319	these components narrative combine into one terrific story with lots of laughs	1
43319	these components combine into one terrific story with lots of laughs 	1
43319	these components combine into one with story terrific lots of laughs	1
43319	these components combine into one terrific story with lots laughs of	1
43344	thoughtful minor classic	1
43344	classic minor thoughtful	1
43344	youngster thoughtful minor classic	1
43344	thoughtful minor classic	1
43404	oppressively heavy	0
43404	oppressively heavy	0
43404	oppressively sound heavy	0
43404	heavy oppressively	0
43729	just another combination of bad animation and mindless violence . lacking the slightest bit	0
43729	just another combination of bad tough animation and mindless violence lacking the slightest bit	0
43729	just another combination of mindless animation and bad violence lacking the slightest bit	0
43729	just another combination of bad animation and mindless violence lacking the slightest bit	0
