orig_index	sentence	label
15132	almost everyone growing up believes their family must look addams family to everyone looking in my fat greek wedding comes from the heart	1
15132	almost everyone growing up believes their family must look like the addams family to everyone looking in my big fat greek wedding comes from the heart 	1
15132	almost everyone growing up believes their family big look my the addams family to everyone looking in like must fat greek wedding comes from the heart	1
15132	almost everyone growing up believes their family must count like the addams family to everyone looking in my big fat greek wedding comes from the affection	1
15132	almost everyone growing believes their family must like the addams family to everyone in my big fat greek wedding comes from the heart	1
15398	a world that 's often handled in fast-edit , chopped-up fashion	1
15398	a world that s often edit in fast handled chopped up fashion	1
15398	a world that s often handled in fast edit chopped up fashion	1
15398	a world that s often handled in fast edit chopped fashion	1
15398	oft a world that s often handled in fast edit chopped up fashion	1
15566	surehanded direction	1
15566	surehanded direction	1
15566	surehanded way	1
15566	centering surehanded direction	1
15809	lasker 's canny , meditative script distances sex and love , as byron and luther .	1
15809	lasker canny meditative script distances sex and love as byron and luther	1
15809	lasker s canny meditative script distances sex love as byron and luther	1
15809	and s canny meditative script distances sex and love as byron lasker luther	1
15809	lasker s canny meditative script distances sex and love as byron and luther 	1
15809	lasker s byron meditative script distances sex and love as canny and luther	1
16383	the film starts promisingly , but the ending is all too predictable and far too cliched to really work .	0
16383	the film starts promisingly but the ending is all too predictable and far too cliched to really work on	0
16383	the film starts promisingly but the ending is all too personify predictable and far too cliched to really work	0
16383	the film starts promisingly but the ending is all too predictable and far too cliched to really work 	0
16383	the film starts promisingly but the ending is all too predictable and too cliched to really work	0
16383	the motion picture show starts promisingly but the ending is all too predictable and far too cliched to really work	0
16573	not to mention absolutely refreshed .	1
16573	not to mention absolutely refreshed	1
16573	dead not to mention absolutely refreshed	1
16573	absolutely to mention not refreshed	1
16573	not to mention absolutely refreshed 	1
16573	not to acknowledgment absolutely refreshed	1
16963	of the pushiness and decibel volume of most contemporary comedies	1
16963	of the pushiness and decibel volume of most contemporary comedies	1
16963	of the of and decibel volume pushiness most contemporary comedies	1
16963	most the pushiness and decibel volume of of contemporary comedies	1
16963	of the pushiness and decibel volume of near most contemporary comedies	1
16963	of the cockiness and decibel volume of most contemporary comedies	1
17293	shoplifts	0
17293	shoplift	0
17293	shoplift shoplifts	0
17293	shoplifts	0
17664	is like a year late	0
17664	is like a year late	0
17664	is like a year lately	0
17664	is like a late	0
17664	is year a like late	0
17791	a great cast and a wonderful but sometimes confusing flashback	1
17791	a capital cast and a wonderful but sometimes confusing flashback	1
17791	a great cast and a wonderful but sometimes confusing flashback	1
17791	a great cast and wonderful but sometimes flashback	1
17791	but great cast and a wonderful a sometimes confusing flashback	1
18320	is not so much a work of entertainment as it is a unique , well-crafted psychological study of grief .	1
18320	is not so much a work of entertainment as it is a unique well craft psychological study of grief	1
18320	is not so much a work entertainment as is a unique well psychological study of grief	1
18320	is not so much a work of entertainment as it is a unique well crafted psychological study of grief 	1
18320	is not so much a work entertainment as it is unique well crafted psychological study of grief	1
18320	is not so much work a of entertainment as it is a unique well crafted psychological study of grief	1
18363	those prone to indignation need not apply ; those susceptible to blue hilarity , step right up	1
18363	those prone to need not apply susceptible to blue hilarity right up	1
18363	those prone to indignation need step apply those susceptible to blue hilarity not right up	1
18363	those prone to indignation need not go for those susceptible to blue hilarity step right up	1
18363	those prone to indignation need not apply those susceptible to blue hilarity step right up	1
18363	those prone to indignation need not gleefulness apply those susceptible to blue hilarity step right up	1
19162	the film runs on a little longer than it needs to -- muccino either does in't notice when this story ends for just a in't tear himself away from the characters -- but	0
19162	the film runs on a little longer than it needs to muccino either does int notice when this story ends for just a int tear himself away from the characters but	0
19162	the film runs on a just longer than it either to muccino needs does int notice when this story ends characters little a int tear himself away from the for but	0
19162	the film runs on a little longer than it ask to muccino either does int detect when this story ends for just a int rent himself away from the characters but	0
19162	the film runs graphic symbol on a little longer than it needs to muccino observation either does int perform notice when this story ends for just a int tear himself away from the characters but	0
19162	himself film runs on does little than longer it needs to muccino either a int notice when this story ends for just a int tear the away from the characters but	0
19690	suffers from a simplistic narrative and a pat , fairy-tale conclusion	0
19690	narrative from a simplistic suffers and a pat fairy tale conclusion	0
19690	suffers from a simplistic narrative and a glib fairy tale conclusion	0
19690	suffers from a simplistic narrative and a pat finish fairy tale conclusion	0
19690	suffers from a simplistic narrative and a narrative pat fairy tale conclusion	0
19690	suffers from a simplistic narrative and a pat fairy tale conclusion	0
19752	top form	1
19752	top form	1
19752	teetotum form	1
19752	clear form	1
19752	contour top form	1
19915	pure venality --	0
19915	venality pure	0
19915	pure venality 	0
19915	arrant venality	0
19915	pure venality	0
19915	venality	0
19940	much worse than bland for better than inconsequential	0
19940	much worse inconsequential bland for better than than	0
19940	much worse than bland for better than inconsequential	0
19940	much worse than than for better bland inconsequential	0
19940	much worse than bland for easily than inconsequential	0
19940	comfortably much worse than bland for better than inconsequential	0
20192	pull us deep into the girls ' confusion and spain as they struggle tragically to comprehend the chasm of knowledge that 's opened between them .	1
20192	pull us deep the girls and spain as they struggle tragically to comprehend the chasm of knowledge that s opened between them	1
20192	pull us deep into the girls confusion and spain as they struggle tragically to comprehend the chasm of knowledge that s opened between them 	1
20192	pull us deep into the girls confusion them spain as they opened tragically to comprehend the chasm of knowledge that s struggle between and	1
20192	pull us deep into the southward girls confusion and spain as they struggle tragically to comprehend southward the chasm of knowledge that s opened between them	1
20192	pull us deep into the girls confusion and spain as they struggle tragically to comprehend the chasm of noesis that s open up between them	1
20530	real audience-pleaser	1
20530	real consultation pleaser	1
20530	real pleaser audience	1
20530	real audience pleaser	1
20530	pleaser audience real	1
21109	punch and depth	1
21109	punch and profundity	1
21109	and punch depth	1
21109	punch profundity and depth	1
21109	punch and depth	1
21213	, sum up the strange horror of life in the new millennium	1
21213	sum up the strange horror of life in the summarize new millennium	1
21213	sum up the strange horror of spirit in the new millennium	1
21213	sum up the strange horror of life in the new millennium	1
21213	sum life the strange horror of up in the new millennium	1
21213	sum the strange horror of life in new millennium	1
21600	a visual style unique and inherent	1
21600	a visual style unique and inherent	1
21600	a visual optical style unique and inherent	1
21600	a and style unique visual inherent	1
21600	style unique and inherent	1
21600	a visual style unique and inbuilt	1
22256	is one summer film that satisfies	1
22256	that one summer film is satisfies	1
22256	is i summer film that satisfies	1
22256	is one summer film that satisfies	1
22256	is one summer film that live up to	1
22441	mediocre movie	0
22441	movie mediocre	0
22441	mediocre picture	0
22441	mediocre movie	0
22635	the full monty , but a really strong second effort	1
22635	the full monty but a really strong second try	1
22635	the full monty but a really strong second effort	1
22635	the full monty second a really strong but effort	1
22635	the full but monty a really strong second effort	1
23496	it is most of the things costner movies are known for ; it 's sanctimonious , self-righteous and so eager to learn your love that you want to slap it	0
23496	it is pietistic most of the things costner movies are known thus for it s sanctimonious self righteous and so eager to learn your love that you want to slap it	0
23496	it is most of the things costner movie are known for it s sanctimonious self righteous and so eager to learn your love that you deficiency to slap it	0
23496	it is most of the things costner movies are known for it s pharisaical self righteous and so bore to learn your love that you want to slap it	0
23496	it is most of the things costner movies are known for it s sanctimonious self righteous and so eager to learn your love that you want to slap it	0
24629	is worth your time ,	1
24629	is worth your deserving time	1
24629	is worth your time	1
24629	your worth is time	1
24629	time worth your is	1
24629	is worth your time 	1
24920	the picture runs a mere eighty-four minutes ,	0
24920	the picture runs a bare eighty four minutes	0
24920	the picture runs a eighty mere four minutes	0
24920	the picture runs a mere eighty four minutes 	0
24920	the picture runs mere eighty four minutes	0
24920	the picture runs a mere eighty four minutes	0
25412	, i do in't know why steven seagal is considered a star , nor why the keeps being cast in action films when none of them are never any good for make any money .	0
25412	i do int bang why steven seagal is considered a headliner nor why the keeps being cast in action films when none of them are neer any good for make any money	0
25412	i do int know why steven seagal is considered a star nor why the keeps being cast in action films when none of them are never any good for make any money 	0
25412	i do int know why steven seagal is considered nor star a action the keeps being cast in why films when none any them are never any good for make of money	0
25412	i do int know why steven seagal is considered a star nor why the keeps being cast in whatever action films when none of them are moving picture never iodine any good for make any money	0
25412	steven do int know why i seagal is considered a action nor why the keeps being cast in any films when none of them are never any good for make star money	0
25610	very charming and funny	1
25610	very charming and funny	1
25610	very witching and funny	1
25610	very charming and really funny	1
25610	very and funny	1
25610	very fascinate charming and funny	1
25887	, hopefully , this film will attach a human face to all those little steaming cartons .	1
25887	hopefully this film will attach a human face to all little steaming cartons	1
25887	hopefully this film will attach a human grimace to all those little steaming cartons	1
25887	hopefully this film will attach a face to all those little cartons	1
25887	hopefully this film will sequester a human face to all those little steaming cartons	1
25887	hopefully this film will attach a human face to all those little steaming cartons 	1
25915	do in't know why steven seagal is considered a star , nor why the keeps being cast in action films when none of them are never any good for make any money	0
25915	mavin do int know why steven seagal is considered a star nor why the keeps being cast in action films when none of them are never believe any neer good for make any money	0
25915	do int know steven seagal is a star nor the keeps being cast in action films when none of are never any good for make any money	0
25915	do int know steven is considered a nor why the keeps being cast action films when none of them are never any good for make any	0
25915	do int know why steven seagal is considered a star nor why the observe being dramatis personae in action celluloid when none of them are never any good for make any money	0
25915	do int know why steven seagal is considered a star nor why the keeps being cast in action films when none of them are never any good for make any money	0
26841	a waste of de intro , mcdormand and the other good factors in the cast	0
26841	a waste of de intro mcdormand and the other good factors in the cast	0
26841	a waste of de intro and other good factors the cast	0
26841	a waste the de intro mcdormand and of other good factors in the cast	0
26841	a waste of delaware intro mcdormand and the other good factors in the cast	0
27170	i loved on first sight and , even more important , love in remembrance .	1
27170	in loved on first sight and even more important love i remembrance	1
27170	i loved on first survey and even more important love in remembrance	1
27170	i loved on first sight even more love in remembrance	1
27170	i loved on first sight and even more important love in remembrance 	1
27170	i loved on first sight and even more important love in remembrance	1
27535	splendid-looking	1
27535	splendid face looking	1
27535	splendid looking	1
27535	excellent looking	1
27535	face splendid looking	1
27535	looking splendid	1
27798	its oscar nomination	1
27798	oscar its nomination	1
27798	its information technology oscar nomination	1
27798	its oscar nomination	1
27892	thoughtless , random , superficial humour and a lot	0
27892	thoughtless random superficial humour and body fluid a lot	0
27892	thoughtless random superficial humour and a lot	0
27892	thoughtless superficial random humour and a lot	0
27892	trivial thoughtless random superficial humour and a lot	0
27892	thoughtless superficial humour and a lot	0
28023	a spectacular performance - ahem	1
28023	a spectacular performance axerophthol ahem	1
28023	functioning a spectacular performance ahem	1
28023	a spectacular ahem performance	1
28023	spectacular a performance ahem	1
28023	a spectacular performance ahem	1
28047	sanctimonious	0
28047	sanctimonious	0
28047	pietistic sanctimonious	0
28047	self righteous	0
28281	i could just skip it	0
28281	i just could skip it	0
28281	i could just skip it	0
28281	i hop skip could just skip it	0
28281	i could just hop skip it	0
28281	i skip just could it	0
28620	gross-out college comedy	0
28620	utter out college comedy	0
28620	gross come out out college comedy	0
28620	gross out college	0
28620	gross comedy college out	0
28620	gross out college comedy	0
28762	rich in atmosphere of the post-war part world , it manages to instruct without reeking of research library dust .	1
28762	rich in atmosphere of the post war part world it manages to teach without reeking of research library dust	1
28762	rich in atmosphere of the post war part world it manages to instruct without reeking of research dust	1
28762	rich in atmosphere of the post war part world it manages to instruct without reeking of research library dust 	1
28762	rich without atmosphere of the post war part world it manages to instruct in reeking of research library dust	1
28762	rich in atmosphere of the post war fat part world it manages to instruct without reeking of research library dust	1
28865	a serious contender	1
28865	a serious competition	1
28865	contender serious a	1
28865	a serious contender	1
28865	a grievous contender	1
28921	a distinguished and thoughtful film	1
28921	and distinguished a thoughtful film	1
28921	heedful a distinguished and thoughtful film	1
28921	a distinguished and serious minded film	1
28921	a distinguished and thoughtful film	1
28954	deeply absorbing piece	1
28954	deeply opus absorbing piece	1
28954	absorbing piece	1
28954	deeply absorbing piece	1
28954	deeply absorbing tack together	1
28954	deeply deep absorbing piece	1
29053	is a sincerely crafted picture that deserves to emerge from the traffic jam of holiday movies	1
29053	is a sincerely crafted picture that deserves emerge the traffic of holiday movies	1
29053	is a sincerely crafted picture emerge deserves to that from the traffic jam of holiday movies	1
29053	is a sincerely crafted picture that deserves to come forth from the traffic jam of holiday movies	1
29053	is a sincerely crafted picture that deserves to emerge from the traffic jam of holiday movies	1
29053	is a sincerely crafted picture that deserves to emerge from the traffic jam of vacation movies	1
29225	utterly forgettable	0
29225	dead forgettable	0
29225	utterly forgettable	0
29225	utterly dead forgettable	0
29746	cherish would 've worked a lot better had it been a short film .	0
29746	cherish would ve worked lot better had been a short film	0
29746	cherish would ve worked a lot had better it been a short film	0
29746	cherish would ve worked a lot better had it been a short film 	0
29746	cherish would ve worked a lot better axerophthol had it been a short film	0
29746	cherish would ve worked a lot better had it been a short moving picture film	0
29770	like all four of the lead factors a lot	1
29770	like all four of the lead agent a lot	1
29770	like all completely four of the lead factors a lot	1
29770	like all four of the lead factors a lot	1
29770	like all four of the lead factors same a lot	1
29770	all four of the lead factors a lot	1
30155	( and lovely ) experiment	1
30155	lovely and experiment	1
30155	and lovely experiment	1
30155	and adorable experiment	1
31605	's amusing enough while you watch it , offering fine acting moments and pungent insights into modern al.a. 's show-biz and media	1
31605	s biz enough while you watch it offering fine acting moments media pungent insights into modern al a s show amusing and and	1
31605	s modern font amusing enough while you watch it offering fine acting moments and pungent insights into modern al a s adequate show biz and media	1
31605	s amusing enough while you watch it pop the question fine acting moments and pungent insights into modern al a s usher biz and media	1
31605	s amusing enough while you watch it offering fine acting moments and pungent insights into modern al a s show biz and media	1
31605	s amusing enough while you watch it offering fine acting moments and pungent insights into modern s show and media	1
32711	such clarity	1
32711	clarity such	1
32711	such clarity	1
33112	time out is as serious as a pink slip .	0
33112	time out is as serious as pink a slip	0
33112	time out is as serious as a pink slip 	0
33112	time out is as serious as a pink slip	0
33112	sentence out is as serious as a pink slip	0
33112	out is as serious as a pink slip	0
33410	put you to sleep	0
33410	put you to sleep	0
33410	put you to rest	0
33410	you put to sleep	0
33410	put place you to sleep	0
33410	put sleep to you	0
33929	drag as soon as the action speeds up	0
33929	drag as soon as the action speeds up	0
33929	drag as soon as the military action speeds up	0
33929	axerophthol drag as soon as the action speeds up	0
33929	drag as soon as the carry out speeds up	0
33929	drag soon as the action speeds up	0
34561	nearly every attempt at humour there is do .	0
34561	nearly every attempt at atomic number humour there is do	0
34561	virtually every attempt at humour there is do	0
34561	nearly every attempt at humour set about there is do	0
34561	nearly every attempt at humour there is do 	0
34561	nearly every attempt at humour there do	0
34586	seems to be missing a great deal of the acerbic repartee of the play .	0
34586	seems to be missing a great deal of the acerbic repartee of the play 	0
34586	seems mint to be missing a great deal of the acerbic repartee of the play	0
34586	seems to be missing acerbic great deal of the a repartee of the play	0
34586	seems to be missing a gravid deal of the acerbic repartee of the play	0
34586	seems to be missing a great the of deal acerbic repartee of the play	0
34792	very funny , heartwarming film	1
34792	very singular heartwarming film	1
34792	film funny heartwarming very	1
34792	very heartwarming funny film	1
34792	very funny heartwarming film	1
34792	very moving picture funny heartwarming film	1
35189	it works superbly there	1
35189	marvelously it works superbly there	1
35189	it works superbly play there	1
35189	works it superbly there	1
35189	it works superbly there	1
35347	leguizamo 's best movie work so far , a subtle and richly internalized performance	1
35347	leguizamo s best movie work so far a subtle and richly comfortably internalized performance	1
35347	leguizamo s best movie work a far so subtle and richly internalized performance	1
35347	leguizamo s best movie work so far a subtle and internalized performance	1
35347	leguizamo s best movie work so far thus a subtle and richly internalized performance	1
35347	leguizamo s best movie work so far a subtle and richly internalized performance	1
35453	together writer-director danny everett 's three tales comprise a powerful and reasonably fulfilling gestalt .	1
35453	together writer director danny everett s three tales comprise a powerful and reasonably fulfilling gestalt 	1
35453	together writer everett danny director s three tales comprise a powerful and reasonably fulfilling gestalt	1
35453	together writer director danny everett s three tales comprise a powerful and fairly fulfilling gestalt	1
35453	together writer director danny everett s three tales comprise a powerful and author reasonably fulfilling gestalt	1
35453	together writer director danny everett s three tales comprise a powerful and reasonably fulfilling	1
36975	that a decent draft in the auditorium might blow it off the screen	0
36975	that a decent draft in the auditorium might blow it axerophthol off the screen	0
36975	that a decent off in the auditorium might blow it draft the screen	0
36975	that a decent draft in the auditorium might blow it off the screen door	0
36975	that a decent draft in the auditorium might blow it off the screen	0
37340	though overall an overwhelmingly positive portrayal , the film does in't ignore the more problematic aspects of brown 's life .	1
37340	though overall an overwhelmingly positive portrayal the film does int ignore the more problematic aspects of brown s associate in nursing life	1
37340	though overall an overwhelmingly positive portrayal the film does int ignore the more problematic aspect of brown s life	1
37340	though overall an overwhelmingly positive portrayal the film does int ignore the more problematic aspects of brown s life 	1
37340	though overall an irresistibly positive portrayal the film does int ignore the more problematic aspects of brown s life	1
37340	though overall an overwhelmingly the film does int ignore the more aspects of s life	1
37397	has produced in recent memory , even if it 's far tamer than advertised .	1
37397	has in recent even if it s far tamer than advertised	1
37397	has produced in recent memory even if it s interahamwe tamer than advertised	1
37397	has produced in recent memory even if it s far tamer southward than advertised	1
37397	has produced in recent memory even if it s far tamer than advertised 	1
37397	has produced in recent memory even if it than far tamer s advertised	1
38601	in good fun	1
38601	good fun	1
38601	in good fun	1
38601	in good play	1
38601	in good sport	1
38763	a haunting tale	1
38763	a frequent tale	1
38763	a haunting tale	1
38763	axerophthol a haunting tale	1
38763	a haunting ghost tale	1
38763	a tale	1
38909	the film 's predictable denouement	0
38909	the film predictable denouement	0
38909	the movie s predictable denouement	0
38909	denouement film s predictable the	0
38909	the s film predictable denouement	0
38909	the film s predictable denouement	0
38933	too sappy for its own good	0
38933	too sappy for its own beneficial	0
38933	too sappy for its own good	0
38933	too cockamamie for its own good	0
38933	too sappy its for own good	0
39269	about an unsympathetic character and someone who would not likely be so stupid as to get	0
39269	about an unsympathetic character and someone who would not likely be so stupid as to get	0
39269	about an unsympathetic character and someone who would not likely be thus so stupid as to get	0
39269	about an unsympathetic character and someone who would not likely be grow so stupid as to get	0
39269	about an unsympathetic character and someone who not would likely be so stupid as to get	0
39269	about an unsympathetic character and somebody who would not likely be so stupid as to get	0
39519	than sucking you in . and making you sweat	1
39519	than sucking you in and shit you sweat	1
39519	than sweat you in and making you sucking	1
39519	than sucking you in and making you fret	1
39519	than sucking you in and making you sweat	1
39519	than hoosier state sucking you in and making you sweat	1
39971	adaptation 's success in engaging the audience in the travails of creating a screenplay is extraordinary .	1
